{
  "versao": 1,
  "status_global": "HIPOTESE",
  "fonte": "ING-0002: 02-mapa/matriz-entregas-x-lanes.md (sha256 7e353301a452…) + 02-mapa/inventario-skills.md §D (sha256 0a2bf6d262c3…)",
  "nota": "Disponibilidade = verificação do pacote no ambiente do usuário (não reverificada nesta sessão; E0 local). Toda linha é HIPÓTESE até E2 validar executando a skill num caso real.",
  "lanes": [
    {
      "id": "produto",
      "nome": "Produto",
      "origem": "macro",
      "skills_oficiais": [
        "product-management:*"
      ],
      "skills_proprietarias": [
        "rc-cognitive-risk-expert",
        "executar-safe-frameworks"
      ],
      "nota": "plugin Product Management não instalado (D4)"
    },
    {
      "id": "engenharia",
      "nome": "Engenharia",
      "origem": "macro",
      "skills_oficiais": [
        "engineering:architecture",
        "engineering:system-design",
        "engineering:code-review",
        "engineering:documentation",
        "engineering:tech-debt"
      ],
      "skills_proprietarias": [
        "rc-cognitive-risk-expert"
      ]
    },
    {
      "id": "design",
      "nome": "Design",
      "origem": "macro",
      "skills_oficiais": [
        "design:accessibility-review",
        "design:design-critique",
        "design:design-handoff",
        "design:design-system",
        "design:research-synthesis",
        "design:user-research",
        "design:ux-copy"
      ],
      "skills_proprietarias": [
        "executar-design",
        "executar-block-quick-frameworks"
      ]
    },
    {
      "id": "qa",
      "nome": "QA",
      "origem": "macro",
      "skills_oficiais": [
        "engineering:testing-strategy",
        "engineering:code-review",
        "engineering:debug",
        "design:accessibility-review"
      ],
      "skills_proprietarias": [
        "rc-cognitive-risk-expert"
      ],
      "nota": "validadores das próprias skills; subagente qa-reviewer (somente leitura)"
    },
    {
      "id": "devops",
      "nome": "DevOps",
      "origem": "macro",
      "skills_oficiais": [
        "engineering:deploy-checklist",
        "engineering:incident-response",
        "operations:change-request",
        "operations:runbook"
      ],
      "skills_proprietarias": [],
      "nota": "conectores Railway/Vercel/Supabase (esquemas não lidos); Cloudflare sem conector identificado"
    },
    {
      "id": "stakeholders",
      "nome": "Stakeholders",
      "origem": "macro",
      "skills_oficiais": [
        "operations:status-report",
        "product-management:stakeholder-update"
      ],
      "skills_proprietarias": [
        "executar-business-docx"
      ],
      "nota": "product-management:stakeholder-update não instalada (D4)"
    },
    {
      "id": "operacoes",
      "nome": "Operações",
      "origem": "macro",
      "skills_oficiais": [
        "operations:*"
      ],
      "skills_proprietarias": [
        "copiloto-executar",
        "executar-mapa-os",
        "plano-operacional-rastreavel"
      ]
    },
    {
      "id": "editorial",
      "nome": "Editorial",
      "origem": "derivada",
      "skills_oficiais": [
        "marketing:*"
      ],
      "skills_proprietarias": [
        "obsidian-editorial-pipeline",
        "executar-block-quick-frameworks",
        "rc-cognitive-risk-expert"
      ],
      "nota": "lane derivada de 'linha editorial e campanhas' — confirmar em E1; obsidian-editorial-pipeline não instalada (D5)"
    }
  ],
  "entregas": [
    {
      "id": "R-001",
      "entrega": "PRD",
      "grupo": "Produto e requisitos",
      "lane": "produto",
      "primaria": {
        "skill": "product-management:write-spec",
        "disponivel": "nao"
      },
      "apoio": [
        "rc-cognitive-risk-expert (templates/prd.md, 13 seções)"
      ],
      "lacuna": "Plugin PM não instalado; fallback disponível: template RC (Problem … Release state)",
      "status": "HIPOTESE",
      "decisao_ref": [
        "D4"
      ]
    },
    {
      "id": "R-002",
      "entrega": "UX / flows",
      "grupo": "Produto e requisitos",
      "lane": "design",
      "primaria": {
        "skill": null,
        "disponivel": "A DEFINIR"
      },
      "apoio": [
        "design:user-research",
        "design:design-critique",
        "design:design-handoff",
        "design:ux-copy",
        "rc-cognitive-risk-expert (§ User journey)"
      ],
      "lacuna": "Sem skill dedicada a 'flows'; fluxos em Mermaid flowchart TD (padrão do Quick Frameworks)",
      "status": "HIPOTESE",
      "decisao_ref": []
    },
    {
      "id": "R-003",
      "entrega": "FRD",
      "grupo": "Produto e requisitos",
      "lane": "produto",
      "primaria": {
        "skill": "rc-cognitive-risk-expert",
        "disponivel": "sim"
      },
      "apoio": [
        "engineering:system-design (requisitos)"
      ],
      "lacuna": "FRD como documento separado ou seção do PRD? A DEFINIR",
      "status": "HIPOTESE",
      "decisao_ref": []
    },
    {
      "id": "R-004",
      "entrega": "AC (acceptance criteria)",
      "grupo": "Produto e requisitos",
      "lane": "produto",
      "primaria": {
        "skill": "rc-cognitive-risk-expert",
        "disponivel": "sim"
      },
      "apoio": [
        "engineering:testing-strategy"
      ],
      "lacuna": null,
      "status": "HIPOTESE",
      "decisao_ref": []
    },
    {
      "id": "R-005",
      "entrega": "NFR",
      "grupo": "Produto e requisitos",
      "lane": "engenharia",
      "primaria": {
        "skill": "engineering:system-design",
        "disponivel": "sim"
      },
      "apoio": [
        "design:accessibility-review",
        "rc-cognitive-risk-expert (§ Accessibility/NFR)"
      ],
      "lacuna": null,
      "status": "HIPOTESE",
      "decisao_ref": []
    },
    {
      "id": "R-006",
      "entrega": "Data / Integration requirements",
      "grupo": "Produto e requisitos",
      "lane": "engenharia",
      "primaria": {
        "skill": "engineering:system-design",
        "disponivel": "sim"
      },
      "apoio": [
        "rc-cognitive-risk-expert (§ Data/claim requirements)"
      ],
      "lacuna": "Integration depende de conectores cujos esquemas não foram lidos",
      "status": "HIPOTESE",
      "decisao_ref": []
    },
    {
      "id": "R-007",
      "entrega": "Analytics",
      "grupo": "Produto e requisitos",
      "lane": "operacoes",
      "primaria": {
        "skill": "marketing:performance-report",
        "disponivel": "sim"
      },
      "apoio": [
        "product-management:metrics-review (não instalada)",
        "Power BI (D4-v1)"
      ],
      "lacuna": "Metas numéricas A DEFINIR (briefing não fornece)",
      "status": "HIPOTESE",
      "decisao_ref": [
        "D4",
        "D4-v1"
      ]
    },
    {
      "id": "R-008",
      "entrega": "Release constraints",
      "grupo": "Produto e requisitos",
      "lane": "devops",
      "primaria": {
        "skill": "engineering:deploy-checklist",
        "disponivel": "sim"
      },
      "apoio": [
        "operations:change-request",
        "rc-cognitive-risk-expert (§ Release state)"
      ],
      "lacuna": "RC 'release state' ≠ 'release constraints' — distinguir em E2",
      "status": "HIPOTESE",
      "decisao_ref": []
    },
    {
      "id": "R-009",
      "entrega": "Eng review",
      "grupo": "Engenharia",
      "lane": "engenharia",
      "primaria": {
        "skill": "engineering:code-review",
        "disponivel": "sim"
      },
      "apoio": [
        "engineering:architecture (desenho)"
      ],
      "lacuna": null,
      "status": "HIPOTESE",
      "decisao_ref": []
    },
    {
      "id": "R-010",
      "entrega": "Spec",
      "grupo": "Engenharia",
      "lane": "engenharia",
      "primaria": {
        "skill": "engineering:system-design",
        "disponivel": "sim"
      },
      "apoio": [
        "rc-cognitive-risk-expert (agent-handoff.md)"
      ],
      "lacuna": null,
      "status": "HIPOTESE",
      "decisao_ref": []
    },
    {
      "id": "R-011",
      "entrega": "ADRs",
      "grupo": "Engenharia",
      "lane": "engenharia",
      "primaria": {
        "skill": "engineering:architecture",
        "disponivel": "sim"
      },
      "apoio": [
        "rc-cognitive-risk-expert (templates/adr.md)"
      ],
      "lacuna": "Dois formatos de ADR (oficial × RC) — escolher um",
      "status": "HIPOTESE",
      "decisao_ref": [
        "D10"
      ]
    },
    {
      "id": "R-012",
      "entrega": "API contracts",
      "grupo": "Engenharia",
      "lane": "engenharia",
      "primaria": {
        "skill": "engineering:system-design",
        "disponivel": "sim"
      },
      "apoio": [],
      "lacuna": "Formato formal (ex.: OpenAPI): A DEFINIR",
      "status": "HIPOTESE",
      "decisao_ref": []
    },
    {
      "id": "R-013",
      "entrega": "Data model",
      "grupo": "Engenharia",
      "lane": "engenharia",
      "primaria": {
        "skill": "engineering:system-design",
        "disponivel": "sim"
      },
      "apoio": [],
      "lacuna": null,
      "status": "HIPOTESE",
      "decisao_ref": []
    },
    {
      "id": "R-014",
      "entrega": "Test plan",
      "grupo": "Engenharia",
      "lane": "qa",
      "primaria": {
        "skill": "engineering:testing-strategy",
        "disponivel": "sim"
      },
      "apoio": [
        "contratos/C-03-eval-suite.md"
      ],
      "lacuna": "Eval de agente ≠ teste de código: cobrir ambos",
      "status": "HIPOTESE",
      "decisao_ref": []
    },
    {
      "id": "R-015",
      "entrega": "Implementation plan",
      "grupo": "Engenharia",
      "lane": "engenharia",
      "primaria": {
        "skill": null,
        "disponivel": "A DEFINIR"
      },
      "apoio": [
        "executar-arvore-roadmap (hipótese)"
      ],
      "lacuna": "Sem skill oficial dedicada",
      "status": "HIPOTESE",
      "decisao_ref": []
    },
    {
      "id": "R-016",
      "entrega": "Epic issues",